{
  "schema_version": "complex_legal_human_gold_review@1.0.0",
  "dataset_id": "gdpr_2016_679_articles_5_50_seeded50_v1",
  "membership_sha256": "9a6a2c892e6e9ef86877066fb3c88ad03d06ca999c41ecbd91c6df35d09c28b9",
  "status": "template_pending_human_annotation",
  "records": [
    {
      "sample_id": "gdpr_2016_679_art005_par002",
      "source_locator": "ARTICLE[@IDENTIFIER='005']/PARAG[@IDENTIFIER='005.002']",
      "source_text": "The controller shall be responsible for, and be able to demonstrate compliance with, paragraph 1 ( accountability ).",
      "source_text_sha256": "e43a7c30a7c29aa33b1150d5ea652076ac5fb46799741cde02c14d936b1805af",
      "review_state": "needs_review",
      "record_decision": "unreviewed",
      "canonical_gold": null,
      "decisions": {
        "source_verified": "unreviewed",
        "clause_segmentation": "unreviewed",
        "modality": "unreviewed",
        "actors": "unreviewed",
        "actions": "unreviewed",
        "conditions": "unreviewed",
        "constraints": "unreviewed",
        "exceptions": "unreviewed",
        "actor_action_map": "unreviewed",
        "order_relations": "unreviewed"
      },
      "reviewer": null,
      "reviewed_at": null,
      "notes": null
    },
    {
      "sample_id": "gdpr_2016_679_art006_par001",
      "source_locator": "ARTICLE[@IDENTIFIER='006']/PARAG[@IDENTIFIER='006.001']",
      "source_text": "Processing shall be lawful only if and to the extent that at least one of the following applies: (a) the data subject has given consent to the processing of his or her personal data for one or more specific purposes; (b) processing is necessary for the performance of a contract to which the data subject is party or in order to take steps at the request of the data subject prior to entering into a contract; (c) processing is necessary for compliance with a legal obligation to which the controller is subject; (d) processing is necessary in order to protect the vital interests of the data subject or of another natural person; (e) processing is necessary for the performance of a task carried out in the public interest or in the exercise of official authority vested in the controller; (f) processing is necessary for the purposes of the legitimate interests pursued by the controller or by a third party, except where such interests are overridden by the interests or fundamental rights and freedoms of the data subject which require protection of personal data, in particular where the data subject is a child. Point (f) of the first subparagraph shall not apply to processing carried out by public authorities in the performance of their tasks.",
      "source_text_sha256": "5893d514e53781812a7a7c2100adbcfd074b1321d4ec8c78494f423513ad9c04",
      "review_state": "needs_review",
      "record_decision": "unreviewed",
      "canonical_gold": null,
      "decisions": {
        "source_verified": "unreviewed",
        "clause_segmentation": "unreviewed",
        "modality": "unreviewed",
        "actors": "unreviewed",
        "actions": "unreviewed",
        "conditions": "unreviewed",
        "constraints": "unreviewed",
        "exceptions": "unreviewed",
        "actor_action_map": "unreviewed",
        "order_relations": "unreviewed"
      },
      "reviewer": null,
      "reviewed_at": null,
      "notes": null
    },
    {
      "sample_id": "gdpr_2016_679_art007_par004",
      "source_locator": "ARTICLE[@IDENTIFIER='007']/PARAG[@IDENTIFIER='007.004']",
      "source_text": "When assessing whether consent is freely given, utmost account shall be taken of whether, inter alia , the performance of a contract, including the provision of a service, is conditional on consent to the processing of personal data that is not necessary for the performance of that contract.",
      "source_text_sha256": "ed5eb59fd66aef70982d33130dc116cd6ed70f42121b19ca32c266142cb64758",
      "review_state": "needs_review",
      "record_decision": "unreviewed",
      "canonical_gold": null,
      "decisions": {
        "source_verified": "unreviewed",
        "clause_segmentation": "unreviewed",
        "modality": "unreviewed",
        "actors": "unreviewed",
        "actions": "unreviewed",
        "conditions": "unreviewed",
        "constraints": "unreviewed",
        "exceptions": "unreviewed",
        "actor_action_map": "unreviewed",
        "order_relations": "unreviewed"
      },
      "reviewer": null,
      "reviewed_at": null,
      "notes": null
    },
    {
      "sample_id": "gdpr_2016_679_art008_par002",
      "source_locator": "ARTICLE[@IDENTIFIER='008']/PARAG[@IDENTIFIER='008.002']",
      "source_text": "The controller shall make reasonable efforts to verify in such cases that consent is given or authorised by the holder of parental responsibility over the child, taking into consideration available technology.",
      "source_text_sha256": "4a572b9fde1b8fd97666c3cb5925d2edd2527b4969b67ab65fb7fcf84124e267",
      "review_state": "needs_review",
      "record_decision": "unreviewed",
      "canonical_gold": null,
      "decisions": {
        "source_verified": "unreviewed",
        "clause_segmentation": "unreviewed",
        "modality": "unreviewed",
        "actors": "unreviewed",
        "actions": "unreviewed",
        "conditions": "unreviewed",
        "constraints": "unreviewed",
        "exceptions": "unreviewed",
        "actor_action_map": "unreviewed",
        "order_relations": "unreviewed"
      },
      "reviewer": null,
      "reviewed_at": null,
      "notes": null
    },
    {
      "sample_id": "gdpr_2016_679_art009_par002",
      "source_locator": "ARTICLE[@IDENTIFIER='009']/PARAG[@IDENTIFIER='009.002']",
      "source_text": "Paragraph 1 shall not apply if one of the following applies: (a) the data subject has given explicit consent to the processing of those personal data for one or more specified purposes, except where Union or Member State law provide that the prohibition referred to in paragraph 1 may not be lifted by the data subject; (b) processing is necessary for the purposes of carrying out the obligations and exercising specific rights of the controller or of the data subject in the field of employment and social security and social protection law in so far as it is authorised by Union or Member State law or a collective agreement pursuant to Member State law providing for appropriate safeguards for the fundamental rights and the interests of the data subject; (c) processing is necessary to protect the vital interests of the data subject or of another natural person where the data subject is physically or legally incapable of giving consent; (d) processing is carried out in the course of its legitimate activities with appropriate safeguards by a foundation, association or any other not-for-profit body with a political, philosophical, religious or trade union aim and on condition that the processing relates solely to the members or to former members of the body or to persons who have regular contact with it in connection with its purposes and that the personal data are not disclosed outside that body without the consent of the data subjects; (e) processing relates to personal data which are manifestly made public by the data subject; (f) processing is necessary for the establishment, exercise or defence of legal claims or whenever courts are acting in their judicial capacity; (g) processing is necessary for reasons of substantial public interest, on the basis of Union or Member State law which shall be proportionate to the aim pursued, respect the essence of the right to data protection and provide for suitable and specific measures to safeguard the fundamental rights and the interests of the data subject; (h) processing is necessary for the purposes of preventive or occupational medicine, for the assessment of the working capacity of the employee, medical diagnosis, the provision of health or social care or treatment or the management of health or social care systems and services on the basis of Union or Member State law or pursuant to contract with a health professional and subject to the conditions and safeguards referred to in paragraph 3; (i) processing is necessary for reasons of public interest in the area of public health, such as protecting against serious cross-border threats to health or ensuring high standards of quality and safety of health care and of medicinal products or medical devices, on the basis of Union or Member State law which provides for suitable and specific measures to safeguard the rights and freedoms of the data subject, in particular professional secrecy; (j) processing is necessary for archiving purposes in the public interest, scientific or historical research purposes or statistical purposes in accordance with Article 89(1) based on Union or Member State law which shall be proportionate to the aim pursued, respect the essence of the right to data protection and provide for suitable and specific measures to safeguard the fundamental rights and the interests of the data subject.",
      "source_text_sha256": "03cccfb889d4e79ea01ba6e2d897344c8066896820ff045973c5cb24803de717",
      "review_state": "needs_review",
      "record_decision": "unreviewed",
      "canonical_gold": null,
      "decisions": {
        "source_verified": "unreviewed",
        "clause_segmentation": "unreviewed",
        "modality": "unreviewed",
        "actors": "unreviewed",
        "actions": "unreviewed",
        "conditions": "unreviewed",
        "constraints": "unreviewed",
        "exceptions": "unreviewed",
        "actor_action_map": "unreviewed",
        "order_relations": "unreviewed"
      },
      "reviewer": null,
      "reviewed_at": null,
      "notes": null
    },
    {
      "sample_id": "gdpr_2016_679_art010_par000",
      "source_locator": "ARTICLE[@IDENTIFIER='010']/ALINEA[1]",